{
  "schemaVersion": 1,
  "id": "crypto.decrypt.utf8-plaintext",
  "specRefs": [
    "crypto.aes-cbc",
    "crypto.padding"
  ],
  "description": "Inverse: Multi-byte UTF-8 is encrypted as raw bytes.",
  "provenance": "openssl enc",
  "operation": "crypto.decrypt",
  "input": {
    "keyBase64": "AAECAwQFBgcICQoLDA0ODw==",
    "ivBase64": "EBESExQVFhcYGRobHB0eHw==",
    "ciphertextHex": "3206e535ad72ab4aa2539e2fe62342ba1503c21756eed8864e6beb9dc97008767c921416c9c8d3aadf793262748f0226"
  },
  "expect": {
    "outcome": "ok",
    "value": {
      "plaintextHex": "7265713a3a31313232333334343a7365745661722822c581617a69656e6b61222c22c5bcc3b3c582772229"
    }
  }
}
