{
  "schemaVersion": 1,
  "id": "coercion.truthy.int-zero",
  "specRefs": [
    "devices.coercion"
  ],
  "description": "truthy: standard truthiness; null is unknown.",
  "provenance": "spec §6.2",
  "operation": "coercion.truthy",
  "input": {
    "value": {
      "type": "int",
      "value": "0"
    }
  },
  "expect": {
    "outcome": "ok",
    "value": {
      "result": false
    }
  }
}
