{
  "schemaVersion": 1,
  "id": "session.scenario.re-registration-runs-30-s-after-the-previous-one",
  "specRefs": [
    "session.chunking",
    "session.loops",
    "session.report-routing"
  ],
  "description": "30 s after a registration was sent (not after its reply) the session registers the same keys again as the same session on the main socket and reports the fresh values.",
  "provenance": "spec §5.3–§5.4 text, conformance.md §4b",
  "operation": "session.scenario",
  "input": {
    "clu": {
      "id": "CLU_1",
      "ip": "10.0.0.1",
      "port": 1234
    },
    "responseTimeoutMs": 5000,
    "pingIntervalMs": 3600000,
    "steps": [
      {
        "call": "start",
        "as": "start"
      },
      {
        "expectSent": {
          "socket": "@main",
          "msgId": "$ka",
          "payload": "checkAlive()"
        }
      },
      {
        "respond": {
          "socket": "@main",
          "msgId": "$ka",
          "payload": "1"
        }
      },
      {
        "await": "start",
        "result": null
      },
      {
        "expectState": "ready"
      },
      {
        "call": "register",
        "keys": [
          {
            "type": "variable",
            "name": "x_a"
          },
          {
            "type": "attribute",
            "objectName": "DOU1001",
            "index": "0"
          }
        ],
        "as": "reg"
      },
      {
        "expectSent": {
          "socket": "@main",
          "msgId": "$m1",
          "payload": "SYSTEM:clientRegister(0,0,1,{\"x_a\",{DOU1001,0}})"
        }
      },
      {
        "advance": 3000
      },
      {
        "respond": {
          "socket": "@main",
          "msgId": "$m1",
          "payload": "clientReport:1:{1,\"ON\"}"
        }
      },
      {
        "await": "reg",
        "result": {
          "slots": [
            {
              "type": "int",
              "value": "1"
            },
            {
              "type": "string",
              "value": "ON"
            }
          ]
        }
      },
      {
        "advance": 26999
      },
      {
        "expectQuiet": true
      },
      {
        "advance": 1
      },
      {
        "expectSent": {
          "socket": "@main",
          "msgId": "$m2",
          "payload": "SYSTEM:clientRegister(0,0,1,{\"x_a\",{DOU1001,0}})"
        }
      },
      {
        "respond": {
          "socket": "@main",
          "msgId": "$m2",
          "payload": "clientReport:1:{0,\"OFF\"}"
        }
      },
      {
        "expectReport": {
          "keys": [
            {
              "type": "variable",
              "name": "x_a"
            },
            {
              "type": "attribute",
              "objectName": "DOU1001",
              "index": "0"
            }
          ],
          "values": [
            {
              "type": "int",
              "value": "0"
            },
            {
              "type": "string",
              "value": "OFF"
            }
          ]
        }
      },
      {
        "advance": 30000
      },
      {
        "expectSent": {
          "socket": "@main",
          "msgId": "$m3",
          "payload": "SYSTEM:clientRegister(0,0,1,{\"x_a\",{DOU1001,0}})"
        }
      },
      {
        "respond": {
          "socket": "@main",
          "msgId": "$m3",
          "payload": "clientReport:1:{0,\"OFF\"}"
        }
      },
      {
        "expectReport": {
          "keys": [
            {
              "type": "variable",
              "name": "x_a"
            },
            {
              "type": "attribute",
              "objectName": "DOU1001",
              "index": "0"
            }
          ],
          "values": [
            {
              "type": "int",
              "value": "0"
            },
            {
              "type": "string",
              "value": "OFF"
            }
          ]
        }
      }
    ]
  },
  "expect": {
    "outcome": "ok",
    "value": {
      "completed": true
    }
  }
}
