{
  "schemaVersion": 1,
  "id": "value.cast.double-upper-exponent-sign",
  "specRefs": [
    "model.cast"
  ],
  "description": "castString(\"1.5E+3\")",
  "provenance": "spec §3.1 + §9.2",
  "operation": "value.cast",
  "input": {
    "text": "1.5E+3"
  },
  "expect": {
    "outcome": "ok",
    "value": {
      "value": {
        "type": "double",
        "bits": "4097700000000000",
        "decimal": "1500.0"
      }
    }
  }
}
