{
  "schemaVersion": 1,
  "id": "payload.action.value-verbatim",
  "specRefs": [
    "payload.action"
  ],
  "description": "Values are interpolated without escaping (documented injection caveat).",
  "provenance": "spec §5.3.4 literal",
  "operation": "payload.action",
  "input": {
    "action": {
      "event": "CLICK",
      "cluId": "CLU_501234567",
      "objectName": "DIM1234",
      "value": "1\") x(\"",
      "callType": "ATTRIBUTE",
      "index": "0"
    }
  },
  "expect": {
    "outcome": "ok",
    "value": {
      "payload": "DIM1234:set(0,\"1\") x(\"\")"
    }
  }
}
