{
  "schemaVersion": 1,
  "id": "payload.report.mixed-types",
  "specRefs": [
    "payload.report"
  ],
  "description": "Every element goes through castString.",
  "provenance": "spec §5.3.2",
  "operation": "payload.report",
  "input": {
    "payload": "clientReport:1:{nil,true,-7,3e2,tekst}"
  },
  "expect": {
    "outcome": "ok",
    "value": {
      "sessionId": 1,
      "values": [
        {
          "type": "null"
        },
        {
          "type": "bool",
          "value": true
        },
        {
          "type": "int",
          "value": "-7"
        },
        {
          "type": "double",
          "bits": "4072c00000000000",
          "decimal": "300.0"
        },
        {
          "type": "string",
          "value": "tekst"
        }
      ]
    }
  }
}
