{
  "schemaVersion": 1,
  "id": "value.cast.inf-is-string",
  "specRefs": [
    "model.cast"
  ],
  "description": "castString(\"inf\")",
  "provenance": "spec §3.1 + §9.2",
  "operation": "value.cast",
  "input": {
    "text": "inf"
  },
  "expect": {
    "outcome": "ok",
    "value": {
      "value": {
        "type": "string",
        "value": "inf"
      }
    }
  }
}
