{
  "schemaVersion": 1,
  "id": "crypto.decrypt.spec-vector-ping",
  "specRefs": [
    "crypto.aes-cbc",
    "crypto.padding"
  ],
  "description": "Inverse of the spec §9.1 golden vector (ping).",
  "provenance": "spec §9.1 + openssl",
  "operation": "crypto.decrypt",
  "input": {
    "keyBase64": "AAECAwQFBgcICQoLDA0ODw==",
    "ivBase64": "EBESExQVFhcYGRobHB0eHw==",
    "ciphertextHex": "5eab3361763eb47aecf01654656faa9b4e31ef685544739464c5291048d6ab60"
  },
  "expect": {
    "outcome": "ok",
    "value": {
      "plaintextHex": "7265713a3a61616262636364643a636865636b416c6976652829"
    }
  }
}
